{
  "$schema": "https://json-schema.org/draft/2020-12/schema",
  "title": "Immobilie",
  "type": "array",
  "items": {
    "type": "object",
    "required": ["immobilie_id", "bezeichnung", "eigentumsanteile", "status"],
    "additionalProperties": false,
    "properties": {
      "immobilie_id": { "type": "string", "pattern": "^IMM-\\d{3,}$" },
      "bezeichnung": { "type": "string", "minLength": 1 },
      "eigentumsanteile": {
        "type": "array",
        "minItems": 1,
        "items": {
          "type": "object",
          "required": ["person_id", "zaehler", "nenner"],
          "additionalProperties": false,
          "properties": {
            "person_id": { "type": "string", "pattern": "^PER-\\d{3,}$" },
            "zaehler": { "type": "integer", "minimum": 1 },
            "nenner": { "type": "integer", "minimum": 1 }
          }
        }
      },
      "status": { "type": "string", "enum": ["aktiv", "verkauft"] },
      "adresse": { "type": "string" },
      "anschaffungsdatum": { "type": "string", "format": "date" },
      "anschaffungskosten": { "type": "string", "pattern": "^(0|[1-9]\\d*)\\.\\d{2}$" },
      "nutzung": { "type": "string", "enum": ["selbstgenutzt", "vermietet", "teilvermietet"] },
      "wohnflaeche": { "type": "string", "pattern": "^(0|[1-9]\\d*)\\.\\d{2}$", "description": "Wohnflaeche in m2 als Decimal-String" },
      "quelle_hinweis": { "type": "string" },
      "quelle_standdatum": { "type": "string", "format": "date" },
      "aktiv_bis": { "type": "string", "format": "date" },
      "bemerkung": { "type": "string" }
    }
  }
}
